{
  "adjacency": [
    {
      "regionA": 1,
      "regionB": 2,
      "sharedBoundaryCoverage": 0.5,
      "uniqueSharedEdgeCount": 2
    },
    {
      "regionA": 1,
      "regionB": 3,
      "sharedBoundaryCoverage": 0.5,
      "uniqueSharedEdgeCount": 8
    },
    {
      "regionA": 1,
      "regionB": 4,
      "sharedBoundaryCoverage": 0.5,
      "uniqueSharedEdgeCount": 2
    },
    {
      "regionA": 1,
      "regionB": 5,
      "sharedBoundaryCoverage": 0.5,
      "uniqueSharedEdgeCount": 6
    },
    {
      "regionA": 1,
      "regionB": 6,
      "sharedBoundaryCoverage": 0.5,
      "uniqueSharedEdgeCount": 6
    },
    {
      "regionA": 1,
      "regionB": 7,
      "sharedBoundaryCoverage": 0.5,
      "uniqueSharedEdgeCount": 2
    },
    {
      "regionA": 1,
      "regionB": 8,
      "sharedBoundaryCoverage": 0.5,
      "uniqueSharedEdgeCount": 2
    },
    {
      "regionA": 1,
      "regionB": 9,
      "sharedBoundaryCoverage": 0.5,
      "uniqueSharedEdgeCount": 2
    },
    {
      "regionA": 1,
      "regionB": 10,
      "sharedBoundaryCoverage": 0.5,
      "uniqueSharedEdgeCount": 4
    },
    {
      "regionA": 1,
      "regionB": 11,
      "sharedBoundaryCoverage": 0.5,
      "uniqueSharedEdgeCount": 4
    },
    {
      "regionA": 1,
      "regionB": 12,
      "sharedBoundaryCoverage": 0.5,
      "uniqueSharedEdgeCount": 2
    },
    {
      "regionA": 1,
      "regionB": 13,
      "sharedBoundaryCoverage": 0.5,
      "uniqueSharedEdgeCount": 2
    },
    {
      "regionA": 1,
      "regionB": 14,
      "sharedBoundaryCoverage": 1.0,
      "uniqueSharedEdgeCount": 714
    },
    {
      "regionA": 1,
      "regionB": 15,
      "sharedBoundaryCoverage": 0.5,
      "uniqueSharedEdgeCount": 4
    },
    {
      "regionA": 1,
      "regionB": 16,
      "sharedBoundaryCoverage": 0.5,
      "uniqueSharedEdgeCount": 2
    },
    {
      "regionA": 1,
      "regionB": 17,
      "sharedBoundaryCoverage": 0.5,
      "uniqueSharedEdgeCount": 3
    },
    {
      "regionA": 1,
      "regionB": 18,
      "sharedBoundaryCoverage": 0.49887133,
      "uniqueSharedEdgeCount": 442
    },
    {
      "regionA": 1,
      "regionB": 19,
      "sharedBoundaryCoverage": 1.0,
      "uniqueSharedEdgeCount": 752
    },
    {
      "regionA": 1,
      "regionB": 20,
      "sharedBoundaryCoverage": 0.50834725,
      "uniqueSharedEdgeCount": 1218
    },
    {
      "regionA": 1,
      "regionB": 22,
      "sharedBoundaryCoverage": 1.0,
      "uniqueSharedEdgeCount": 744
    },
    {
      "regionA": 1,
      "regionB": 23,
      "sharedBoundaryCoverage": 0.5,
      "uniqueSharedEdgeCount": 2
    },
    {
      "regionA": 1,
      "regionB": 24,
      "sharedBoundaryCoverage": 0.5,
      "uniqueSharedEdgeCount": 4
    },
    {
      "regionA": 1,
      "regionB": 25,
      "sharedBoundaryCoverage": 0.5,
      "uniqueSharedEdgeCount": 2
    },
    {
      "regionA": 1,
      "regionB": 26,
      "sharedBoundaryCoverage": 0.5,
      "uniqueSharedEdgeCount": 2
    },
    {
      "regionA": 1,
      "regionB": 27,
      "sharedBoundaryCoverage": 0.5,
      "uniqueSharedEdgeCount": 2
    },
    {
      "regionA": 1,
      "regionB": 28,
      "sharedBoundaryCoverage": 0.5,
      "uniqueSharedEdgeCount": 3
    },
    {
      "regionA": 1,
      "regionB": 29,
      "sharedBoundaryCoverage": 0.5,
      "uniqueSharedEdgeCount": 3
    },
    {
      "regionA": 1,
      "regionB": 30,
      "sharedBoundaryCoverage": 0.47916667,
      "uniqueSharedEdgeCount": 23
    },
    {
      "regionA": 20,
      "regionB": 21,
      "sharedBoundaryCoverage": 1.0,
      "uniqueSharedEdgeCount": 1178
    }
  ],
  "artifacts": {
    "legacyRegions": {
      "path": "benchmarks/fabrication-layer-decomposition/outputs/color-purification/cp-b-aggressive_rc-a/FLD-005/regions.json.gz",
      "sha256": "9af23658a15437e660b0a53554bcca54dc2e74cca7191e72e3a23879e4a82d4e",
      "sizeBytes": 2284
    },
    "metrics": {
      "path": "benchmarks/fabrication-layer-decomposition/outputs/color-purification/cp-b-aggressive_rc-a/FLD-005/metrics.json",
      "sha256": "7ade6f3cec77ae8c06b4033ca7985e21f9258b93fdba1bbac580f6f45552daba",
      "sizeBytes": 3384
    },
    "pixelLabelMap": {
      "path": "benchmarks/fabrication-layer-decomposition/outputs/color-purification/cp-b-aggressive_rc-a/FLD-005/pixel_label_map.npz",
      "sha256": "50662e06003f01b0145b4b595784351e4e0b2161da8cc714587baf100b78a66e",
      "sizeBytes": 7017
    },
    "purifiedRaster": {
      "path": "benchmarks/fabrication-layer-decomposition/outputs/color-purification/cp-b-aggressive_rc-a/FLD-005/purified.png",
      "sha256": "d8f07f98aa071e260049ce423df05c19631f1e5e9b14f54c25c77ab78160ebb2",
      "sizeBytes": 38454
    },
    "runConfig": {
      "path": "benchmarks/fabrication-layer-decomposition/outputs/color-purification/cp-b-aggressive_rc-a/FLD-005/run_config.json",
      "sha256": "8582e1ece638616bf6a204f58b89fb6616798cca34216c529134eecddd0e4985",
      "sizeBytes": 1323
    },
    "source": {
      "path": "benchmarks/fabrication-layer-decomposition/fixtures/source/FLD-005.png",
      "sha256": "242da16c54c59e0c764e5eb00d52f2b276d0130f596b57fac1c0d08a5b868ad0",
      "sizeBytes": 141864
    },
    "structuralLabelMap": {
      "path": "benchmarks/fabrication-layer-decomposition/outputs/color-purification/cp-b-aggressive_rc-a/FLD-005/structural_label_map.npz",
      "sha256": "50662e06003f01b0145b4b595784351e4e0b2161da8cc714587baf100b78a66e",
      "sizeBytes": 7017
    }
  },
  "candidateId": "CP-B",
  "connectivity": {
    "adjacencyConnectivity": 4,
    "componentConnectivity": 4,
    "proposalConnectivity": 8,
    "voidConnectivity": 4
  },
  "contractVersion": "1.0.0",
  "dimensions": {
    "height": 853,
    "width": 534
  },
  "fixtureId": "FLD-005",
  "legacyMetadataDisposition": "LEGACY_COMPONENT_METADATA_SUPERSEDED",
  "productionIntegrationStatus": "NOT_INTEGRATED",
  "profile": "cp-b-aggressive_rc-a",
  "provenance": {
    "artifactGenerationCommit": "c18eb15d23357794dd8178b1daae8bf6e0ac74b7",
    "candidateSourceGitBlob": "8945e305be3f0cb309d442da3f352321c7167175",
    "p0_04cUpstreamBaselineCommit": "4dc782343fbf02836d9cf36a8bd42975eec41d2f",
    "runConfigSha256": "8582e1ece638616bf6a204f58b89fb6616798cca34216c529134eecddd0e4985",
    "sourceSha256": "242da16c54c59e0c764e5eb00d52f2b276d0130f596b57fac1c0d08a5b868ad0"
  },
  "regionIdSemantics": {
    "backgroundId": 0,
    "lineage": "identity-only; no repair or merged Region IDs",
    "oneRegionMayContainMultipleFourConnectedComponents": true,
    "orphanFringeId": -1,
    "scope": "fixture-and-profile-local"
  },
  "regions": [
    {
      "area": 19455,
      "assignedPixelCount": 19455,
      "bbox": [
        8,
        8,
        273,
        680
      ],
      "componentCount": 1,
      "components": [
        {
          "area": 19455,
          "bbox": [
            8,
            8,
            273,
            680
          ],
          "componentId": 1
        }
      ],
      "corePixelCount": 15698,
      "perimeterEdgeCount": 5512,
      "regionId": 1,
      "representativeColorLab": [
        0.784314,
        0.0,
        1.0
      ],
      "representativeColorMethod": "RC-A",
      "representativeColorRgb": [
        4,
        2,
        0
      ],
      "sourceRegionIds": [
        1
      ]
    },
    {
      "area": 1,
      "assignedPixelCount": 1,
      "bbox": [
        233,
        10,
        1,
        1
      ],
      "componentCount": 1,
      "components": [
        {
          "area": 1,
          "bbox": [
            233,
            10,
            1,
            1
          ],
          "componentId": 1
        }
      ],
      "corePixelCount": 1,
      "perimeterEdgeCount": 4,
      "regionId": 2,
      "representativeColorLab": [
        89.019608,
        0.0,
        0.0
      ],
      "representativeColorMethod": "RC-A",
      "representativeColorRgb": [
        224,
        224,
        224
      ],
      "sourceRegionIds": [
        2
      ]
    },
    {
      "area": 4,
      "assignedPixelCount": 4,
      "bbox": [
        226,
        13,
        4,
        4
      ],
      "componentCount": 4,
      "components": [
        {
          "area": 1,
          "bbox": [
            229,
            13,
            1,
            1
          ],
          "componentId": 1
        },
        {
          "area": 1,
          "bbox": [
            228,
            14,
            1,
            1
          ],
          "componentId": 2
        },
        {
          "area": 1,
          "bbox": [
            227,
            15,
            1,
            1
          ],
          "componentId": 3
        },
        {
          "area": 1,
          "bbox": [
            226,
            16,
            1,
            1
          ],
          "componentId": 4
        }
      ],
      "corePixelCount": 4,
      "perimeterEdgeCount": 16,
      "regionId": 3,
      "representativeColorLab": [
        85.294121,
        0.0,
        0.0
      ],
      "representativeColorMethod": "RC-A",
      "representativeColorRgb": [
        214,
        214,
        214
      ],
      "sourceRegionIds": [
        3
      ]
    },
    {
      "area": 1,
      "assignedPixelCount": 1,
      "bbox": [
        238,
        17,
        1,
        1
      ],
      "componentCount": 1,
      "components": [
        {
          "area": 1,
          "bbox": [
            238,
            17,
            1,
            1
          ],
          "componentId": 1
        }
      ],
      "corePixelCount": 1,
      "perimeterEdgeCount": 4,
      "regionId": 4,
      "representativeColorLab": [
        87.058823,
        0.0,
        0.0
      ],
      "representativeColorMethod": "RC-A",
      "representativeColorRgb": [
        218,
        218,
        218
      ],
      "sourceRegionIds": [
        4
      ]
    },
    {
      "area": 3,
      "assignedPixelCount": 3,
      "bbox": [
        232,